isbn13,title,format,cost,product_url,category_path,sell_price,status,score,listed_at,sold_at,delisted_at,delist_reason,checked_at,offer_id,description,relisted_at,sales_count,protected
9781071803882,Statistics for People Who (Think They) Hate Statis...,Paperback,79.99,https://www.booksgoat.com/statistics-for-people-who-hate-statistics-excel-5th-edition,315,103.99,active,,2026-04-20T08:44:48.706255,,,,2026-05-02T07:00:05.561732,156585880011,"This textbook introduces statistics fundamentals to students and professionals who find the subject intimidating, breaking down complex concepts into accessible explanations. It features practical, real-world examples and exercises designed to build confidence while developing genuine statistical understanding. The second edition includes updated data sets and contemporary case studies relevant to today's applications.",2026-04-25T21:12:22Z,0,false
9781119683810,"Atlas of Operative Oral and Maxillofacial Surgery,...",Paperback,79.99,https://www.booksgoat.com/index.php?route=product/product&path=315&product_id=437184,315,103.99,active,,,,,,2026-05-02T07:00:05.561732,156585900011,"Atlas of Operative Oral and Maxillofacial Surgery is a clinical reference designed for oral surgeons, maxillofacial surgeons, and dental professionals seeking detailed procedural guidance. This edition features high-quality surgical illustrations and step-by-step visual documentation to support intraoperative decision-making. ISBN: 9781119683810.",2026-04-25T21:12:22Z,0,false
9781119793595,Practical Early Orthodontic Treatment: A Case-Base...,Paperback,89.99,https://www.booksgoat.com/index.php?route=product/product&path=315&product_id=437183,315,116.99,active,,,,,,2026-05-02T07:00:05.561732,156585923011,Practical Early Orthodontic Treatment provides clinical guidance for orthodontists and dental professionals managing pediatric patients with developing dentitions. This case-based resource uses real-world scenarios to illustrate treatment planning and decision-making throughout early intervention phases. The book combines evidence-based protocols with visual documentation to support clinical application.,2026-04-25T21:12:22Z,0,false
9781071904244,Meeting the Ethical Challenges of Leadership: Cast...,Paperback,69.99,https://www.booksgoat.com/meeting-ethical-challenges-leadership-8th-edition,315,90.99,active,,,,,,2026-05-02T07:00:05.561732,156585942011,"Meeting the Ethical Challenges of Leadership: Cast provides practical frameworks for navigating moral dilemmas in professional settings, ideal for students and practicing managers seeking to develop their decision-making skills. This text incorporates real-world case studies that allow readers to apply ethical principles directly to actual leadership situations they may encounter.",,0,false
9781071895115,Infants and Children: Prenatal Through Middle Chil...,Paperback,109.99,https://www.booksgoat.com/infants-and-children-prenatal-through-middle-childhood-9th-edition,328,142.99,active,,2026-04-20T08:44:54.840078,,,,2026-05-02T07:00:05.561732,156585973011,"This textbook covers infant and child development from prenatal stages through middle childhood, designed for students in psychology, education, and related fields. The 9th edition includes updated research findings and contemporary case studies that reflect current developmental theories and real-world applications.",2026-04-25T21:12:22Z,0,false
9780521431460,The Cambridge Grammar of the English Language by H...,Paperback,179.99,https://www.booksgoat.com/the-cambridge-grammar-of-the-english-language-9780521431460,328,233.99,active,,,,,,2026-05-02T07:00:05.561732,156586000011,"The Cambridge Grammar of the English Language is a definitive reference work covering modern English grammar and linguistic structure for students, teachers, and language professionals. This authoritative 1,860-page volume (ISBN 9780521431460) provides in-depth analysis with extensive examples and detailed explanations throughout. Includes a comprehensive index for easy navigation of topics.",2026-04-25T21:12:22Z,0,false
9781498754415,Essentials of Clinical Anatomy of the Equine Locom...,Paperback,49.99,https://www.booksgoat.com/essentials-of-clinical-anatomy-of-the-equine-locomotor-system-9781498754415,315,64.99,active,,,,,,2026-05-02T07:00:05.561732,156586025011,This textbook covers clinical anatomy of equine locomotion systems and is designed for veterinary students and equine practitioners. The book includes detailed anatomical illustrations and practical applications for diagnosing and treating lameness in horses. ISBN 9781498754415.,2026-04-25T21:12:22Z,0,false
9781119611868,Valuation: Measuring and Managing the Value of Com...,Paperback,54.99,https://www.booksgoat.com/Valuation-Measuring-and-Managing-the-Value-9781119610885,315,71.49,active,,2026-04-20T08:45:00.988976,,,,2026-05-02T07:00:05.561732,156586047011,"This textbook covers valuation principles and techniques for measuring and managing company value, designed for finance students and professionals seeking practical corporate valuation skills. The latest edition includes updated case studies and real-world applications that reflect current market practices. Includes practice problems and detailed solutions to reinforce learning concepts.",2026-04-25T21:12:22Z,0,false
9783319493848,Complications of Regional Anesthesia: Principles o...,Paperback,109.99,https://www.booksgoat.com/complications-of-regional-anesthesia-3rd-edition-9783319493848,315,142.99,active,,2026-04-20T08:45:06.866241,,,,2026-05-02T07:00:05.561732,156586080011,"This textbook provides medical professionals with in-depth coverage of complications arising from regional anesthesia procedures and evidence-based strategies for prevention and management. The book features detailed clinical guidance with practical approaches to identify and address adverse outcomes during regional anesthetic techniques. Written for anesthesiologists and pain management specialists, it serves as a valuable reference for both training and clinical practice.",2026-04-25T21:12:22Z,0,false
9781591268420,"PPI NCIDQ Interior Design Reference Manual, 7th Ed...",Paperback,79.99,https://www.booksgoat.com/ppi-ncidq-interior-design-reference-manual-7th-edition-9781591268420,315,103.99,active,,2026-04-20T08:45:18.686251,,,,2026-05-02T07:00:05.561732,156586145011,"This PPI NCIDQ Interior Design Reference Manual, 7th Edition, covers the knowledge and skills required for the NCIDQ certification exam and is designed for interior design professionals preparing for licensure. The 7th edition includes updated content and practice problems to reinforce key concepts. ISBN: 9781591268420.",2026-04-25T21:12:22Z,0,false
9780128197820,"Mergers, Acquisitions, and Other Restructuring Act...",Paperback,69.99,https://www.booksgoat.com/index.php?route=product/product&path=315&product_id=437456,315,90.99,active,,2026-04-20T08:45:24.735247,,,,2026-05-02T07:00:05.561732,156586171011,"Comprehensive textbook covering mergers, acquisitions, and corporate restructuring strategies for business students and professionals seeking in-depth knowledge of deal structures and transaction mechanics. This edition includes updated case studies and real-world examples that illustrate current market practices and regulatory considerations. ISBN 9780128197820.",2026-04-25T21:12:22Z,0,false
9781119831945,Practical Portfolio Performance Measurement and At...,Paperback,46.99,https://www.booksgoat.com/index.php?route=product/product&path=315&product_id=437187,315,61.09,active,,2026-04-20T08:45:30.183637,,,,2026-05-02T07:00:05.561732,156586183011,"This textbook covers practical methods for measuring and analyzing portfolio performance, ideal for investment professionals and finance students seeking real-world application skills. The book includes detailed case studies and quantitative frameworks that translate theoretical concepts into actionable investment strategies.",2026-04-25T21:12:22Z,0,false
9781071817179,Tests & Measurement for People Who (Think They...,Paperback,63.99,https://www.booksgoat.com/index.php?route=product/product&path=315&product_id=437321,315,83.19,active,,2026-04-20T08:45:40.736498,,,,2026-05-02T07:00:05.561732,156586198011,"This textbook covers psychological and educational testing and measurement concepts, designed for students who find the subject intimidating or confusing. It uses accessible language and practical examples to break down complex statistical and assessment principles. The book includes real-world applications that help readers understand how measurement theory applies to actual testing scenarios.",2026-04-25T21:12:22Z,0,false
9780973501827,Back Mechanic by Dr. Stuart McGill (2015 Edition) ...,Paperback,19.99,https://www.booksgoat.com/back-mechanic-stuart-mcgill-9780973501827,315,,pending,,,,,,,156576888011,"Back Mechanic by Dr. Stuart McGill (2015 Edition) ...

ISBN-13: 9780973501827",,0,false
9781078847728,Kaplan Securities Industry Essentials (SIE) Licens...,Paperback,29.99,https://www.booksgoat.com/kaplan-sie-exam-manual-4th-edition-9781078847728,315,73.39,active,6.054253,2026-04-20T07:25:50.431672,,,,2026-05-02T07:00:05.561732,156586219011,"# Kaplan Securities Industry Essentials (SIE) License Exam Prep

This study guide prepares candidates to pass the Securities Industry Essentials licensing exam with detailed content review and test strategies. The book includes hundreds of practice questions and answers to reinforce key concepts and exam formats. ISBN 9781078847728.",,0,false
9780367026509,"Nonlinear Dynamics and Chaos, 3rd Edition by Steve...",Paperback,49.99,https://www.booksgoat.com/nonlinear-dynamics-and-chaos-3rd-edition-9780367026509,315,64.99,active,,,,,,2026-05-02T07:00:05.561732,156586231011,"Nonlinear Dynamics and Chaos, 3rd Edition by Steve Strogatz introduces mathematical theory and applications of nonlinear systems for students and researchers in physics, engineering, and mathematics. This third edition includes updated examples, expanded problem sets, and modern computational approaches to the subject. The ISBN is 9780367026509.",,0,false
9780128197738,"Marschner’s Mineral Nutrition of Plants, 4th Edi...",Paperback,69.99,https://www.booksgoat.com/index.php?route=product/product&path=315&product_id=437499,315,90.99,active,,,,,,2026-05-02T07:00:05.561732,156586244011,"Marschner's Mineral Nutrition of Plants, 4th Edition, covers the biochemical and physiological processes of plant mineral uptake and metabolism for students and researchers in plant science and agriculture. This edition includes updated research on nutrient interactions and plant responses to mineral deficiencies. The ISBN is 9780128197738.",2026-04-25T21:12:22Z,0,false
9781119391968,"MRI in Practice, 5th Edition by Catherine Westbroo...",Paperback,47.99,https://www.booksgoat.com/MRI-In-Practice-9781119391968,315,62.39,active,,2026-04-20T08:45:50.499550,,,,2026-05-02T07:00:05.561732,156586266011,"MRI in Practice, 5th Edition by Catherine Westbrook covers magnetic resonance imaging principles, techniques, and clinical applications for healthcare professionals and students preparing for MRI careers. This updated edition includes the latest advancements in MRI technology and safety protocols. The ISBN is 9781119391968.",2026-04-25T21:12:22Z,0,false
9780190265717,Practices of Looking: An Introduction to Visual Cu...,Paperback,41.99,https://www.booksgoat.com/practices-of-looking-3rd-edition-9780190265717,315,54.59,active,,2026-04-20T08:45:56.288942,,,,2026-05-02T07:00:05.561732,156586279011,"Practices of Looking: An Introduction to Visual Culture introduces students and general readers to foundational concepts in analyzing images, media, and visual representation across contemporary society. This third edition includes updated examples and case studies reflecting current visual culture trends. The book combines theoretical frameworks with accessible explanations to build critical viewing skills.",2026-04-25T21:12:22Z,0,false
9798989185757,The Essential Guide to Passing the Structural Civi...,Paperback,49.99,https://www.booksgoat.com/the-essential-guide-to-passing-the-structural-civil-9798989185757,315,64.99,active,,,,,,2026-05-02T07:00:05.561732,156586297011,The Essential Guide to Passing the Structural Civil Engineering Exam prepares engineers to master the exam content and build confidence for test day. This book includes hundreds of practice problems with detailed solutions to reinforce key concepts and improve problem-solving skills. ISBN: 9798989185757.,,0,false
9781951058067,The ASQ Certified Manager of Quality/Organizationa...,Paperback,66.99,https://www.booksgoat.com/asq-certified-manager-quality-organizational-excellence-handbook-5th-edition,315,,pending,,,,,,,154195129011,,,0,false
9798987050507,"NYSORA Nerve Block Manual, First Edition by Admir ...",Paperback,79.99,https://www.booksgoat.com/nysora-nerve-block-manual-first-edition,315,167.2,active,2.079937,2026-04-20T14:11:53.558851,,,,2026-05-02T07:00:05.561732,156586311011,"NYSORA Nerve Block Manual, First Edition, provides detailed guidance on regional anesthesia techniques and procedures for medical professionals and anesthesiology students. This first edition includes high-quality anatomical illustrations and step-by-step instructions to support clinical practice and learning. ISBN: 9798987050507.",,0,false
9783319110196,"Evidence-Based Critical Care, 3rd Edition by Paul ...",Paperback,59.99,https://www.booksgoat.com/evidence-based-critical-care-3rd-edition,315,77.99,active,,,,,,2026-05-02T07:00:05.561732,156586326011,"Evidence-Based Critical Care, 3rd Edition by Paul provides clinicians and medical students with practical, research-backed approaches to intensive care management. This edition incorporates the latest clinical evidence and guidelines to support decision-making in critical care settings. ISBN: 9783319110196.",2026-04-25T21:12:22Z,0,false
9780323376518,Small Animal Dermatology: A Color Atlas and Therap...,Paperback,63.99,https://www.booksgoat.com/index.php?route=product/product&path=315&product_id=420745,315,83.19,active,,,,,,2026-05-02T07:00:05.561732,156586350011,Small Animal Dermatology: A Color Atlas and Therapeutic Guide is a clinical resource for veterinarians and veterinary students seeking practical guidance on diagnosing and treating skin conditions in dogs and cats. This illustrated atlas features high-quality color photographs that enable visual identification of dermatological conditions alongside evidence-based treatment protocols. The ISBN is 9780323376518.,2026-04-25T21:12:22Z,0,false
9780387774404,Cognitive Behavioral Treatment of Insomnia: A Sess...,Paperback,59.99,https://www.booksgoat.com/cognitive-behavioral-treatment-of-insomnia-9780387774404,315,77.99,active,,,,,,2026-05-02T07:00:05.561732,156586368011,This textbook provides clinicians and mental health professionals with evidence-based cognitive behavioral techniques for treating insomnia in patients. The book includes detailed session-by-session protocols that practitioners can directly apply in clinical practice. ISBN: 9780387774404.,2026-04-25T21:12:22Z,0,false
9781628256642,PMBOK® Guide – Seventh Edition & The Standa...,Paperback,36.99,https://www.booksgoat.com/pmbok-guide-seventh-edition-9781628256642,315,48.09,active,,2026-04-20T08:46:21.580261,,,,2026-05-02T07:00:05.561732,156586384011,"The PMBOK® Guide Seventh Edition provides project management frameworks and standards for professionals seeking certification or improving their practice across industries. This edition introduces the latest methodologies and reflects current industry practices to help practitioners manage projects effectively. Ideal for students, PMs, and organizations implementing standardized project delivery approaches.",2026-04-25T21:12:22Z,0,false
9781628257830,Process Groups: A Practice Guide by Project Manage...,Paperback,24.99,https://www.booksgoat.com/process-groups-a-practice-guide-9781628257830,315,32.49,delisted,,2026-04-20T08:46:28.204573,,2026-04-23T20:10:44.667699,unavailable,2026-04-22T21:00:06.803666,155659429011,,2026-04-23T19:32:59Z,0,false
9783031266614,The Milan System for Reporting Salivary Gland Cyto...,Paperback,33.99,https://www.booksgoat.com/milan-system-salivary-gland-cytopathology-2nd-edition-9783031266614,315,44.19,active,,,,,,2026-05-02T07:00:05.561732,156586404011,The Milan System for Reporting Salivary Gland Cytopathology provides pathologists and cytotechnologists with standardized diagnostic criteria and classification guidelines for salivary gland specimens. This text features detailed photomicrographs and illustrations that clarify diagnostic categories and improve specimen interpretation accuracy. ISBN: 9783031266614.,,0,false
9783319501390,Anesthesiology: Clinical Case Reviews by Linda S. ...,Paperback,89.99,https://www.booksgoat.com/anesthesiology-clinical-case-reviews-1st-edition-9783319501390,315,116.99,active,,,,,,2026-05-02T07:00:05.561732,156586419011,Anesthesiology: Clinical Case Reviews by Linda S. provides real-world case scenarios designed for anesthesia residents and practitioners seeking to strengthen clinical decision-making skills. This resource features detailed case analyses with practical learning applications across diverse patient populations and anesthesia situations. ISBN: 9783319501390.,2026-04-25T21:12:22Z,0,false
9781544362816,"Statistics for the Behavioral Sciences, 4th Editio...",Paperback,79.99,https://www.booksgoat.com/index.php?route=product/product&path=315&product_id=437867,315,103.99,active,,,,,,2026-05-02T07:00:05.561732,156586466011,"Statistics for the Behavioral Sciences, 4th Edition (ISBN: 9781544362816) introduces statistical concepts and applications for students in psychology, education, and related fields. This edition includes updated real-world examples and practice problems to reinforce learning. The text uses clear explanations to make complex statistical methods accessible to students without advanced mathematical backgrounds.",2026-04-25T21:12:22Z,0,false
9780063390157,"Tiny Humans, Big Emotions: How to Navigate Tantrum...",Paperback,9.99,https://www.booksgoat.com/tiny-humans-big-emotions-9780063390157,315,,pending,,,,,,,156576898011,"Tiny Humans, Big Emotions: How to Navigate Tantrum...

ISBN-13: 9780063390157",,0,false
9780415708234,Healing the Fragmented Selves of Trauma Survivors:...,Paperback,16.99,https://www.booksgoat.com/healing-the-fragmented-selves-of-trauma-survivors-9780415708234,315,22.09,delisted,,2026-04-20T08:46:38.734661,,2026-04-23T22:36:42.166685,unavailable,2026-04-23T21:00:04.159202,155659652011,,2026-04-23T19:32:59Z,0,false
9781891389221,Classical Mechanics by John R. Taylor ISBN: 978189...,Paperback,69.99,https://www.booksgoat.com/classical-mechanics-9781891389221,315,90.99,active,,2026-04-20T08:46:45.598942,,,,2026-05-02T07:00:05.561732,156586484011,"Classical Mechanics by John R. Taylor covers fundamental principles of mechanics through analytical methods and modern applications, ideal for upper-level undergraduates and graduate students. This University Science Books edition includes numerous worked examples and problem sets throughout its 786 pages to reinforce core concepts. The text emphasizes both theoretical foundations and practical problem-solving techniques essential for physics coursework.",2026-04-25T21:12:22Z,0,false
9780962644450,"Understanding Ultrasound Physics, 4th edition by S...",Paperback,79.99,https://www.booksgoat.com/understanding-ultrasound-physics-9780962644450,315,103.99,active,,2026-04-20T08:46:54.395236,,,,2026-05-02T07:00:05.561732,156586499011,"Understanding Ultrasound Physics, 4th edition by S., is a textbook designed for students and professionals learning the fundamental principles of ultrasound imaging and acoustic physics. This fourth edition includes updated content and detailed explanations with practice questions to reinforce key concepts. The book provides a practical foundation for anyone pursuing a career in ultrasound technology or sonography.",2026-04-25T21:12:22Z,0,false
9781636710983,"Fundamentals of Occupational Safety and Health, 8t...",Paperback,42.99,https://www.booksgoat.com/fundamentals-of-occupational-safety-and-health-8th-edition,315,55.89,active,,,,,,2026-05-02T07:00:05.561732,156586519011,"Fundamentals of Occupational Safety and Health, 8th Edition (ISBN: 9781636710983) covers core safety principles and workplace hazard management for students and professionals entering the occupational safety field. This eighth edition includes updated regulations and contemporary case studies reflecting current industry standards. Ideal for classroom use or professional reference.",2026-04-25T21:12:22Z,0,false
9780875532998,Standard Methods for the Examination of Water and ...,Paperback,179.99,https://www.booksgoat.com/standard-methods-examination-water-wastewater,315,233.99,active,,,,,,2026-05-02T07:00:05.561732,156586566011,"This standard reference guide covers water quality testing procedures and analytical methods for environmental professionals, laboratories, and regulatory agencies. The 21st edition includes updated protocols and techniques for examining drinking water, wastewater, and environmental samples. Includes detailed procedures, quality control guidelines, and data interpretation standards.",,0,false
9780867156515,The Biomechanical Foundation of Clinical Orthodont...,Paperback,89.99,https://www.booksgoat.com/biomechanical-foundation-of-clinical-orthodontics,327,116.99,active,,,,,,2026-05-02T07:00:05.561732,156586588011,The Biomechanical Foundation of Clinical Orthodontics provides orthodontic professionals and students with detailed coverage of the mechanical principles underlying tooth movement and treatment planning. This textbook includes detailed illustrations and diagrams that clarify complex biomechanical concepts for practical clinical application. ISBN: 9780867156515.,2026-04-25T21:12:22Z,0,false
9781462550128,"Clinical Handbook of Couple Therapy, 6th Edition b...",Paperback,69.99,https://www.booksgoat.com/clinical-handbook-of-couple-therapy-6th-edition-9781462550128,328,90.99,active,,,,,,2026-05-02T07:00:05.561732,156586621011,"Clinical Handbook of Couple Therapy, 6th Edition (ISBN: 9781462550128) provides practical guidance on evidence-based therapeutic techniques for relationship issues, designed for mental health professionals and couples counselors. This edition includes updated research, case examples, and contemporary clinical approaches to help practitioners address modern relationship challenges. Ideal for students and experienced therapists seeking current resources in couples counseling.",2026-04-25T21:12:22Z,0,false
9780199987559,"A Brief History of the Romans, 2nd Edition by Mary...",Paperback,59.99,https://www.booksgoat.com/a-brief-history-of-the-romans-2nd-edition-9780199987559,315,77.99,active,,,,,,2026-05-02T07:00:05.561732,156586690011,"A Brief History of the Romans, 2nd Edition (ISBN: 9780199987559) covers Roman civilization from its origins through the empire's fall, designed for students and general readers seeking an accessible overview. This updated edition incorporates recent archaeological findings and scholarly perspectives to enhance understanding of Roman political, social, and cultural development. The streamlined narrative makes complex historical topics engaging without sacrificing analytical depth.",2026-04-25T21:12:22Z,0,false
9783319307732,Fundamentals of Clinical Trials by Lawrence M. Fri...,Paperback,49.99,https://www.booksgoat.com/fundamentals-of-clinical-trials-5th-edition-9783319307732,315,64.99,active,,2026-04-20T08:47:05.019491,,,,2026-05-02T07:00:05.561732,156586728011,"This textbook covers the principles and methodologies of clinical trial design and execution, suitable for students and professionals in medicine, biostatistics, and pharmaceutical research. The third edition includes updated regulatory frameworks and contemporary case studies that reflect current industry standards. A practical resource that bridges theoretical concepts with real-world trial applications.",2026-04-25T21:12:22Z,0,false
9781462552795,Motivational Interviewing: Helping People Change a...,Paperback,21.99,https://www.booksgoat.com/motivational-interviewing-4th-edition-9781462552795,315,,pending,,,,,,,154195650011,,,0,false
9781683738299,The Expanded Dialectical Behavior Therapy Skills T...,Paperback,21.99,https://www.booksgoat.com/expanded-dbt-skills-training-manual-3rd-edition-9781683738299,315,28.59,active,,,,,,2026-05-02T07:00:05.561732,156586762011,This expanded guide covers dialectical behavior therapy skills and techniques for mental health professionals and clients seeking to develop emotional regulation and interpersonal effectiveness. The book includes worksheets and practical exercises designed to reinforce learning and support real-world application of DBT strategies.,,0,false
9781640551862,Gapenski’s Healthcare Finance: An Introduction t...,Paperback,69.99,https://www.booksgoat.com/gapenskis-healthcare-finance-7th-edition-9781640551862,315,90.99,active,,2026-04-20T08:47:20.579453,,,,2026-05-02T07:00:05.561732,156586790011,Gapenski's Healthcare Finance: An Introduction provides foundational knowledge in healthcare financial management for students and professionals entering the field. This textbook includes practical examples and case studies designed to illustrate real-world applications of finance concepts in healthcare settings. The 4th edition offers updated content reflecting current industry practices and regulations.,2026-04-25T21:12:22Z,0,false
9781071824566,Uneven Roads: An Introduction to U.S. Racial and E...,Paperback,56.99,https://www.booksgoat.com/index.php?route=product/product&path=315&product_id=437726,315,,pending,,,,,,,154195707011,,,0,false
