isbn13,title,format,cost,product_url,category_path,sell_price,status,score,listed_at,sold_at,delisted_at,delist_reason,checked_at,offer_id,description,relisted_at,sales_count,protected
9781118740651,"Introduction to Stochastic Processes with R, 1st E...",Paperback,42.99,https://www.booksgoat.com/introduction-to-stochastic-processes-with-r-1st-edition-9781118740651,315,55.89,active,,2026-04-20T08:54:20.692990,,,,2026-05-02T07:00:05.561732,156588689011,"This textbook introduces stochastic processes and their applications using R programming, suitable for students and professionals seeking practical understanding of probability and random systems. It combines theoretical foundations with hands-on R code examples throughout, making complex concepts accessible and directly implementable. The first edition provides a bridge between mathematical theory and real-world computational practice.",2026-04-25T21:12:22Z,0,false
9781259644863,"The LSTA's Complete Credit Agreement Guide, 2nd Ed...",Paperback,49.99,https://www.booksgoat.com/lsta-complete-credit-agreement-guide-2nd-edition-9781259644863,315,64.99,active,,,,,,2026-05-02T07:00:05.561732,156588707011,This guide provides credit professionals and loan officers with detailed instruction on interpreting and negotiating loan agreements under LSTA standards. The second edition includes updated model forms and current market practices reflecting recent changes in commercial lending. ISBN: 9781259644863.,2026-04-25T21:12:22Z,0,false
9781960701107,"Florida Building Code – Building, 8th Edition (2...",Paperback,89.99,https://www.booksgoat.com/florida-building-code-2023-book-eighth-edition,315,123.19,active,0.490648,2026-04-20T14:11:53.558851,,,,2026-05-02T07:00:05.561732,156588741011,"Florida Building Code – Building, 8th Edition (2023) covers construction standards and regulations for builders, contractors, and code officials in Florida. This edition incorporates the latest updates to align with current state building requirements and industry practices. ISBN: 9781960701107.",,0,false
9781544391250,"Constitutional Law for a Changing America: Rights,...",Paperback,63.99,https://www.booksgoat.com/constitutional-law-for-a-changing-america-rights-liberties-and-justice-11th-edition-9781544391250,315,83.19,active,,,,,,2026-05-02T07:00:05.561732,156588751011,"Constitutional Law for a Changing America: Rights covers fundamental constitutional principles and landmark court decisions, ideal for law students and those seeking to understand American legal foundations. This edition includes contemporary case analysis and examines how constitutional rights evolve in modern contexts. The text features study questions and practical applications throughout.",2026-04-25T21:12:22Z,0,false
9781544397566,"Leadership: Theory and Practice, 9th Edition by Pe...",Paperback,79.99,https://www.booksgoat.com/leadership-theory-practice-9th-northouse,315,103.99,active,,2026-04-20T08:54:32.204270,,,,2026-05-02T07:00:05.561732,156588769011,"Leadership: Theory and Practice, 9th Edition covers foundational and contemporary leadership concepts for students and professionals seeking to understand effective leadership in organizational settings. This edition includes updated research, case studies, and real-world examples that illustrate leadership principles in practice. ISBN: 9781544397566.",2026-04-25T21:12:22Z,0,false
9781071817940,"Research Design: Qualitative, Quantitative, and Mi...",Paperback,49.99,https://www.booksgoat.com/research-design-6th-edition-creswell,315,64.99,active,,2026-04-20T08:54:38.903951,,,,2026-05-02T07:00:05.561732,156588790011,"This textbook covers qualitative, quantitative, and mixed methods research design, making it ideal for students and researchers learning to plan and conduct empirical studies. The book includes real-world examples and practical guidance to help readers apply research concepts to their own projects. ISBN 9781071817940.",2026-04-25T21:12:22Z,0,false
9781636941226,"The Quality Toolbox, 3rd Edition by Nancy R. Tague...",Paperback,49.99,https://www.booksgoat.com/the-quality-toolbox-3rd-edition-nancy-tague,315,64.99,active,,,,,,2026-05-02T07:00:05.561732,156588801011,"The Quality Toolbox, 3rd Edition by Nancy R. Tague provides practical quality management techniques and statistical methods for professionals across manufacturing, healthcare, and service industries. This updated edition includes new tools and real-world examples to help practitioners implement continuous improvement strategies. The book serves as both a learning resource and an on-the-job reference guide for quality professionals at all experience levels.",,0,false
9781544396781,Essentials of Organizational Behavior: An Evidence...,Paperback,109.99,https://www.booksgoat.com/essentials-of-organizational-behavior-3rd-edition,315,142.99,active,,,,,,2026-05-02T07:00:05.561732,156588810011,Essentials of Organizational Behavior: An Evidence-Based Approach covers core OB concepts and practical applications for students and professionals seeking to understand workplace dynamics. This textbook emphasizes research-backed theories and real-world case studies to build critical thinking skills. ISBN: 9781544396781.,2026-04-25T21:12:22Z,0,false
9781032933832,Considerations on the AI Endgame by Soenke Ziesche...,Paperback,16.99,https://www.booksgoat.com/considerations-on-the-ai-endgame-9781032933832,315,,pending,,,,,,,154197842011,,,0,false
9781412972123,Qualitative Research & Evaluation Methods: Int...,Paperback,73.99,https://www.booksgoat.com/qualitative-research-and-evaluation-methods-4th-edition-9781412972123,315,96.19,active,,2026-04-20T08:54:51.142993,,,,2026-05-02T07:00:05.561732,156588829011,"Qualitative Research & Evaluation Methods provides practical guidance on designing and conducting qualitative studies for researchers, evaluators, and graduate students across social science disciplines. This edition includes real-world examples and case studies that illustrate how to apply research methods in diverse field settings. The book offers step-by-step frameworks for data collection, analysis, and interpretation techniques.",2026-04-25T21:12:22Z,0,false
9781543830903,"The MBE Decoded: Multistate Bar Exam (Bar Review),...",Paperback,39.99,https://www.booksgoat.com/the-mbe-decoded-multistate-bar-exam-first-edition-9781543830903,315,51.99,active,,2026-04-20T08:54:57.999782,,,,2026-05-02T07:00:05.561732,156588856011,"The MBE Decoded is a bar review resource designed for law students preparing for the Multistate Bar Exam, offering targeted study materials to help test-takers master the exam's format and content. This guide includes detailed explanations and practice questions to reinforce key concepts across MBE subjects. ISBN: 9781543830903.",2026-04-25T21:12:22Z,0,false
9781118115121,The Art and Science of Technical Analysis: Market ...,Paperback,35.99,https://www.booksgoat.com/art-and-science-of-technical-analysis-1st-edition-9781118115121,315,46.79,delisted,,,,2026-04-24T18:15:12.362167,unavailable,2026-04-23T22:39:28.288192,155661733011,"Master the technical analysis strategies that professional traders use to identify market trends and make informed trading decisions. This brand-new paperback equips both novice and experienced investors with practical methods for analyzing price charts, volume patterns, and market psychology to predict future price movements. Written for anyone serious about understanding how markets actually work, this guide bridges the gap between theory and real-world trading applications with actionable techniques you can implement immediately. Whether you're day trading stocks, forex, or cryptocurrencies, you'll gain the analytical framework that separates successful traders from casual investors.

This item is sourced internationally to offer significant savings. Tracking information may not update until the package reaches the United States. All books are brand new, in mint condition, and carefully inspected before shipment.",2026-04-23T19:32:59Z,0,false
9780071838931,Hadzic’s Peripheral Nerve Blocks and Anatomy for...,Paperback,56.99,https://www.booksgoat.com/index.php?route=product/product&path=315&product_id=436780,315,74.09,active,,,,,,2026-05-02T07:00:05.561732,156588864011,Hadzic's Peripheral Nerve Blocks and Anatomy for Ultrasound-Guided Regional Anesthesia covers nerve block techniques and anatomical foundations for anesthesiologists and regional anesthesia practitioners. This second edition includes detailed ultrasound guidance protocols and clinical applications for safe procedural performance. ISBN 9780071838931.,2026-04-25T21:12:22Z,0,false
9780791872192,ASME Y14.5-2018: Dimensioning and Tolerancing Stan...,Paperback,189.99,https://www.booksgoat.com/asme-y14-5-2018-dimensioning-tolerancing,315,299.2,active,1.349562,2026-04-20T14:11:53.558851,,,,2026-05-02T07:00:05.561732,156588882011,"ASME Y14.5-2018 is the official standard for dimensioning and tolerancing practices, designed for engineers, drafters, and manufacturing professionals who need to communicate precise specifications on technical drawings. This 2018 edition incorporates the latest updates to geometric dimensioning and tolerancing (GD&T) standards and best practices. ISBN: 9780791872192.",,0,false
9781118753651,"Rocket Propulsion Elements, 9th Edition by George ...",Paperback,59.99,https://www.booksgoat.com/rocket-propulsion-elements-9th-edition-9781118753651,315,77.99,active,,2026-04-20T08:55:13.899324,,,,2026-05-02T07:00:05.561732,154197933011,"Rocket Propulsion Elements, 9th Edition, covers fundamental principles of rocket engine design and propulsion systems for students and professionals in aerospace engineering. This edition includes updated material on modern propulsion technologies and expanded coverage of contemporary applications in space exploration. The textbook contains detailed technical illustrations and worked examples throughout.",,0,false
9780471433316,"Introduction to Real Analysis, 4th Edition by Dona...",Paperback,59.99,https://www.booksgoat.com/introduction-to-real-analysis-4th-edition-9780471433316,315,77.99,active,,2026-04-20T08:55:19.481462,,,,2026-05-02T07:00:05.561732,156588891011,"Introduction to Real Analysis, 4th Edition by Rudin, covers foundational concepts in real analysis including sequences, series, continuity, and integration—ideal for mathematics students and anyone seeking rigorous mathematical foundations. This edition includes over 500 practice problems designed to reinforce theoretical understanding and develop problem-solving skills. ISBN: 9780471433316.",2026-04-25T21:12:22Z,0,false
9780879397883,Fire and Emergency Services Orientation & Term...,Paperback,59.99,https://www.booksgoat.com/fire-and-emergency-services-orientation-terminology-7th-edition-9780879397883,315,,pending,,,,,,,154197972011,,,0,false
9781597381000,"Behavior Analysis for Lasting Change, 5th Edition ...",Paperback,79.99,https://www.booksgoat.com/behavior-analysis-lasting-change-5th-mayer,315,138.03,active,1.177989,2026-04-17T17:55:22.719226,,,,2026-05-02T07:00:05.561732,152616383011,"This fifth edition textbook covers behavior analysis principles and their real-world applications for students and practitioners seeking to create meaningful, sustainable change. The updated edition includes contemporary case studies and research findings that reflect current practice standards. Ideal for coursework or professional reference in psychology, education, and clinical fields.",,0,false
9780470767719,Conduct of Operations and Operational Discipline: ...,Paperback,69.99,https://www.booksgoat.com/conduct-operations-operational-discipline-9780470767719,315,90.99,active,,,,,,2026-05-02T07:00:05.561732,156588910011,"This textbook covers operational discipline and best practices for managing industrial and process operations, ideal for engineers, operators, and safety professionals. The book includes real-world case studies and practical frameworks to improve facility performance and reduce operational risks. ISBN 9780470767719.",2026-04-25T21:12:22Z,0,false
9780521545662,Lisp in Small Pieces by Christian Queinnec – Pap...,Paperback,46.99,https://www.booksgoat.com/index.php?route=product/product&path=327&product_id=436731,327,61.09,active,,,,,,2026-05-02T07:00:05.561732,156588931011,"Lisp in Small Pieces by Christian Queinnec is a practical guide to understanding Lisp implementation and interpreter design, ideal for programmers and computer science students seeking deep technical knowledge. This paperback edition (ISBN 9780521545662) features over 500 pages of detailed explanations and code examples that demonstrate how Lisp systems work from the ground up.",2026-04-25T21:12:22Z,0,false
9780190698614,Elements of Electromagnetics *US HARDCOVER* 7th Ed...,Hardcover,99.99,https://www.booksgoat.com/index.php?route=product/product&path=327&product_id=409416,327,129.99,active,,2026-04-20T08:55:30.415097,,,,2026-05-02T07:00:05.561732,156588947011,"Elements of Electromagnetics, 7th Edition US Hardcover (ISBN 9780190698614), covers electromagnetic theory and applications for engineering and physics students. This edition features updated content and improved problem sets to reinforce core concepts. The text combines theoretical foundations with practical examples suitable for intermediate-level coursework.",2026-04-25T21:12:22Z,0,false
9780831131463,Reliability-Centered Maintenance *US HARDCOVER* 2n...,Hardcover,44.99,https://www.booksgoat.com/index.php?route=product/product&path=327&product_id=409459,327,58.49,active,,2026-04-20T08:55:37.174426,,,,2026-05-02T07:00:05.561732,156588976011,This hardcover textbook covers reliability-centered maintenance principles and practical implementation strategies for maintenance professionals and engineers. The second edition includes updated methodologies and real-world case studies to illustrate key concepts. ISBN 9780831131463.,2026-04-25T21:12:22Z,0,false
9780128220474,Pipe Drafting and Design *US PAPERBACK* 4th Ed by ...,Paperback,63.99,https://www.booksgoat.com/index.php?route=product/product&path=327&product_id=409543,327,83.19,active,,2026-04-20T08:55:42.981889,,,,2026-05-02T07:00:05.561732,156588998011,"Pipe Drafting and Design, 4th Edition, covers piping systems design and drafting techniques for engineers, designers, and students in industrial and mechanical fields. This US paperback edition includes updated standards and practical applications to reflect current industry practices. ISBN: 9780128220474.",2026-04-25T21:12:22Z,0,false
9781439888117,"Protective Relaying: Principles and Applications, ...",Paperback,49.99,https://www.booksgoat.com/protective-relaying-principles-and-applications-4th-edition-9781439888117,327,64.99,active,,,,,,2026-05-02T07:00:05.561732,156589029011,Protective Relaying: Principles and Applications covers the fundamentals of electrical power system protection for engineers and students. This fourth edition includes updated case studies and real-world applications reflecting modern grid technologies. The text combines theoretical concepts with practical design guidance for relay coordination and system reliability.,2026-04-25T21:12:22Z,0,false
9780190643560,Intuitive Biostatistics: A Nonmathematical Guide t...,Paperback,76.99,https://www.booksgoat.com/intuitive-biostatistics-4th-edition-9780190643560,327,100.09,active,,2026-04-20T08:55:48.403397,,,,2026-05-02T07:00:05.561732,156589084011,"Intuitive Biostatistics: A Nonmathematical Guide demystifies statistical concepts for students and researchers who want to understand data analysis without heavy mathematics. This fourth edition (ISBN 9780190643560) emphasizes practical interpretation of real-world biological data through accessible explanations and examples. The book prioritizes conceptual understanding over formulas, making statistics approachable for life science professionals.",2026-04-25T21:12:22Z,0,false
9780873267748,Effective Supervisory Practices: Better Results Th...,Paperback,59.99,https://www.booksgoat.com/effective-supervisory-practices-5th-edition-9780873267748,315,77.99,active,,,,,,2026-05-02T07:00:05.561732,156589109011,Effective Supervisory Practices teaches managers and supervisors how to achieve better workplace results through proven leadership techniques and strategies. This resource includes practical exercises and real-world examples that help readers apply concepts directly to their roles. ISBN: 9780873267748.,2026-04-25T21:12:22Z,0,false
9780763781873,National Incident Management System: Principles an...,Paperback,59.99,https://www.booksgoat.com/national-incident-management-system-principles-practice-2nd-edition,327,77.99,active,,2026-04-20T08:55:58.271145,,,,2026-05-02T07:00:05.561732,156589208011,"This textbook covers National Incident Management System principles and practices, designed for emergency management professionals and students in disaster response fields. The book includes detailed case studies and real-world applications that illustrate how NIMS frameworks are implemented during actual incidents. ISBN 9780763781873.",2026-04-25T21:12:22Z,0,false
9783031101342,Handbook of Abductive Cognition *US HARDCOVER* by ...,Hardcover,299.99,https://www.booksgoat.com/index.php?route=product/product&path=327&product_id=426413,327,389.99,active,,,,,,2026-05-02T07:00:05.561732,156589274011,"This hardcover handbook explores abductive reasoning and cognitive processes for researchers, scholars, and students in psychology, philosophy, and artificial intelligence. It features rigorous peer-reviewed chapters examining inference mechanisms and real-world applications of abductive cognition. ISBN: 9783031101342.",2026-04-25T21:12:22Z,0,false
9781259863387,"Atlas of Pediatric Emergency Medicine, 3rd Edition...",Paperback,89.99,https://www.booksgoat.com/atlas-of-pediatric-emergency-medicine-3rd-edition-9781259863387,315,116.99,active,,2026-04-20T08:56:03.850396,,,,2026-05-02T07:00:05.561732,156589305011,"Atlas of Pediatric Emergency Medicine, 3rd Edition (ISBN: 9781259863387) provides clinical guidance and visual references for emergency physicians and pediatric specialists treating acute pediatric conditions. This edition features full-color illustrations and diagnostic imaging examples that support rapid clinical decision-making in emergency settings.",2026-04-25T21:12:22Z,0,false
9781032450995,"Introduction to the Thermodynamics of Materials, 7...",Paperback,53.99,https://www.booksgoat.com/introduction-thermodynamics-of-materials-7th-edition-gaskell,327,,pending,,,,,,,154198233011,,,0,false
9780195167016,Character Strengths and Virtues: A Handbook and Cl...,Paperback,49.99,https://www.booksgoat.com/index.php?route=product/product&path=327&product_id=436766,327,64.99,active,,,,,,2026-05-02T07:00:05.561732,156589349011,"Character Strengths and Virtues is a handbook that explores positive psychology and human flourishing, designed for students, researchers, and anyone interested in understanding personal development and well-being. This authoritative guide provides a detailed classification system of character strengths grounded in psychological research and philosophical tradition. The book offers practical frameworks for identifying and cultivating strengths in everyday life.",2026-04-25T21:12:22Z,0,false
9780123741349,"Human Osteology, 3rd Edition by Tim D. White (ISBN...",Paperback,54.99,https://www.booksgoat.com/human-osteology-3rd-edition-white,327,71.49,active,,,,,,2026-05-02T07:00:05.561732,156589391011,"Human Osteology, 3rd Edition by Tim D. White covers skeletal anatomy and bone identification for anthropology, archaeology, and forensic science students and professionals. This edition features updated illustrations and expanded content reflecting current research in the field. The text includes practical identification methods and comparative anatomy essential for laboratory work.",,0,false
9781951058098,"The ASQ Certified Quality Auditor Handbook, 5th ed...",Paperback,63.99,https://www.booksgoat.com/asq-certified-quality-auditor-handbook-9781951058098,315,104.68,active,,2026-04-25T20:06:27.107383+00:00,,,,2026-05-02T07:00:05.561732,156568213011,This handbook prepares candidates for the ASQ Certified Quality Auditor exam and serves quality professionals seeking to advance their auditing expertise. The 5th edition has been updated with current standards and includes numerous practice questions to reinforce learning. ISBN: 9781951058098.,,0,false
9780826122391,Eye Movement Desensitization and Reprocessing (EMD...,Paperback,53.99,https://www.booksgoat.com/emdr-scripted-protocols-special-populations-luber,327,70.19,active,,,,,,2026-05-02T07:00:05.561732,156589410011,Eye Movement Desensitization and Reprocessing (EMDR) is a psychotherapy technique covered in this textbook for clinicians and students treating trauma and anxiety disorders. This edition includes detailed treatment protocols and case studies demonstrating real-world application of the EMDR method. ISBN: 9780826122391.,2026-04-25T21:12:22Z,0,false
9780323697071,Varcarolis' Foundations of Psychiatric-Mental Heal...,Paperback,53.99,https://www.booksgoat.com/index.php?route=product/product&path=327&product_id=436861,327,70.19,active,,2026-04-20T08:56:20.696211,,,,2026-05-02T07:00:05.561732,156589433011,"Varcarolis' Foundations of Psychiatric-Mental Health Nursing provides core psychiatric nursing knowledge and clinical applications for nursing students and practicing professionals. This edition includes updated evidence-based interventions, assessment tools, and real-world case studies to support clinical decision-making. The textbook contains over 1,000 pages with integrated learning resources designed to strengthen foundational psychiatric nursing competencies.",2026-04-25T21:12:22Z,0,false
9780813349107,"Nonlinear Dynamics and Chaos, 2nd Edition by Steve...",Paperback,49.99,https://www.booksgoat.com/nonlinear-dynamics-and-chaos-strogatz-2nd-edition,327,64.99,active,,2026-04-20T08:56:27.376366,,,,2026-05-02T07:00:05.561732,156589456011,"This second edition textbook introduces nonlinear dynamics and chaos theory to students and researchers in mathematics, physics, and engineering. The updated edition includes modern examples, improved pedagogy, and numerous worked problems that bridge theory with real-world applications. ISBN 9780813349107.",2026-04-25T21:12:22Z,0,false
9781118431436,"Brown's Boundary Control and Legal Principles, 7th...",Paperback,69.99,https://www.booksgoat.com/browns-boundary-control-legal-principles-7th-edition,327,90.99,active,,,,,,2026-05-02T07:00:05.561732,156589509011,"Brown's Boundary Control and Legal Principles, 7th Edition (ISBN: 9781118431436) covers land surveying fundamentals, boundary determination, and the legal framework governing property lines, designed for surveying professionals and students. This edition includes updated case studies and practical applications that reflect current industry standards and legal developments.",2026-04-25T21:12:22Z,0,false
9780134038940,Foodservice Organizations: A Managerial and System...,Paperback,79.99,https://www.booksgoat.com/foodservice-organizations-managerial-systems-approach-9th-edition-9780134038940,327,103.99,active,,,,,,2026-05-02T07:00:05.561732,156589544011,"Foodservice Organizations: A Managerial and System Approaches, ISBN 9780134038940, covers operational management and organizational systems for students and professionals in the foodservice industry. This textbook includes practical case studies and real-world applications that bridge theory to industry practice. Designed for culinary programs and hospitality management courses, it provides actionable frameworks for managing large-scale food operations.",2026-04-25T21:12:22Z,0,false
9781009397759,Introduction to Electrodynamics by David J. Griffi...,Paperback,35.99,https://www.booksgoat.com/intro-to-electrodynamics-5th-edition-9781009397759,327,52.72,active,,2026-04-25T20:06:32.309957+00:00,,,,2026-05-02T07:00:05.561732,156568223011,"Introduction to Electrodynamics by David J. Griffiths covers electromagnetic theory, fields, and waves for undergraduate and graduate physics students. This latest edition (ISBN 9781009397759) includes updated problems and modern computational examples to enhance learning. The textbook balances theoretical foundations with practical applications throughout.",,0,false
9780470889015,"Interior Graphic Standards: Student Edition, 2nd E...",Paperback,49.99,https://www.booksgoat.com/interior-graphic-standards-student-edition-2nd-edition,327,64.99,active,,2026-04-20T08:56:41.891093,,,,2026-05-02T07:00:05.561732,156589565011,"Interior Graphic Standards Student Edition 2nd Edition covers design principles and technical standards for interior spaces, ideal for students and emerging professionals. This edition includes updated guidelines and visual references for creating professional interior documentation and presentations. ISBN: 9780470889015.",2026-04-25T21:12:22Z,0,false
9781107156050,"Trades, Quotes and Prices: Financial Markets Under...",Paperback,54.99,https://www.booksgoat.com/trades-quotes-and-prices-financial-markets-under-the-microscope-9781107156050,315,71.49,active,,2026-04-20T08:56:47.561315,,,,2026-05-02T07:00:05.561732,156589593011,"Trades, Quotes and Prices explores financial market microstructure and trading mechanisms for advanced students and finance professionals. This hardcover edition includes detailed theoretical frameworks and empirical analysis of how markets operate at the transaction level. Published by Cambridge University Press, it provides rigorous economic foundations for understanding modern trading systems.",2026-04-25T21:12:22Z,0,false
9781032129921,"Lifestyle Medicine, 4th Edition by James M. Rippe ...",Paperback,129.99,https://www.booksgoat.com/lifestyle-medicine-4th-edition,327,,pending,,,,,,,154198360011,,,0,false
