isbn13,title,format,cost,product_url,category_path,sell_price,status,score,listed_at,sold_at,delisted_at,delist_reason,checked_at,offer_id,description,relisted_at,sales_count,protected
9781119337249,Blackwell’s Five-Minute Veterinary: Small Animal...,Paperback,79.99,https://www.booksgoat.com/index.php?route=product/product&path=315&product_id=431879,315,103.99,active,,,,,,2026-05-02T07:00:05.561732,156502355011,"Blackwell's Five-Minute Veterinary Consult for Small Animal Practice provides quick diagnostic and treatment guidance for veterinarians and veterinary students. This reference delivers fast, evidence-based information organized for rapid clinical lookup during patient care. ISBN 9781119337249.",2026-04-25T16:15:01Z,0,false
9781416412267,"An Advanced Review of Speech–Language Pathology,...",Paperback,89.99,https://www.booksgoat.com/advanced-review-of-speech-language-pathology-6th-edition-9781416412267,315,116.99,active,,,,,,2026-05-02T07:00:05.561732,156582469011,"An Advanced Review of Speech–Language Pathology prepares students and professionals for certification exams and clinical practice with in-depth coverage of assessment, treatment, and disorders across the lifespan. This edition includes practice questions and evidence-based clinical guidelines to reinforce key concepts. The detailed content supports both exam preparation and professional reference use.",,0,false
9780199329007,Gardner and Sutherland’s Chromosome Abnormalitie...,Paperback,79.99,https://www.booksgoat.com/index.php?route=product/product&path=315&product_id=432773,315,103.99,active,,2026-04-20T08:31:26.257788,,,,2026-05-02T07:00:05.561732,156582510011,"Gardner and Sutherland's Chromosome Abnormalities provides in-depth coverage of human chromosomal disorders for medical students, geneticists, and clinical professionals. This edition includes detailed illustrations and case studies that clarify complex genetic concepts and their clinical manifestations. The ISBN is 9780199329007.",2026-04-25T21:12:22Z,0,false
9780813349039,"Understanding Architecture: Its Elements, History,...",Paperback,59.99,https://www.booksgoat.com/understanding-architecture-3rd-edition-9780813349039,315,77.99,active,,2026-04-20T08:31:37.423012,,,,2026-05-02T07:00:05.561732,156582532011,"Understanding Architecture: Its Elements, History, and Meaning (ISBN 9780813349039) covers fundamental architectural concepts, historical development, and design principles for students and enthusiasts seeking to interpret built environments. This illustrated guide examines how architectural elements combine to create meaning and function across different periods and cultures. Perfect for anyone wanting to develop a deeper appreciation of the buildings and spaces around them.",2026-04-25T21:12:22Z,0,false
9781138071711,HVAC Water Chillers and Cooling Towers: Fundamenta...,Paperback,59.99,https://www.booksgoat.com/hvac-water-chillers-and-cooling-towers-2nd-edition-9781138071711,315,77.99,active,,2026-04-20T08:31:44.203085,,,,2026-05-02T07:00:05.561732,156582551011,"This textbook covers the fundamentals of HVAC water chillers and cooling towers, designed for students and professionals in mechanical engineering and HVAC system design. The book includes detailed diagrams and technical specifications that support practical understanding of cooling system operation and maintenance. ISBN: 9781138071711.",2026-04-25T21:12:22Z,0,false
9781506323756,Introduction to Clinical Mental Health Counseling:...,Paperback,59.99,https://www.booksgoat.com/clinical-mental-health-counseling-watson-schmit,315,77.99,active,,,,,,2026-05-02T07:00:05.561732,156582569011,"This textbook introduces foundational concepts in clinical mental health counseling, designed for graduate students and aspiring counselors preparing for professional practice. The second edition includes updated research, case studies, and practical applications to bridge theory and real-world clinical work. ISBN: 9781506323756.",2026-04-25T21:12:22Z,0,false
9780890425763,DSM-5-TR: Diagnostic and Statistical Manual of Men...,Paperback,89.99,https://www.booksgoat.com/dsm-5-tr-manual-5th-apa-mental-health,315,116.99,active,,2026-04-20T08:31:51.423771,,,,2026-05-02T07:00:05.561732,156582586011,"The DSM-5-TR is the diagnostic reference manual for mental health and medical professionals, clinicians, and students in psychiatry and psychology. This text-revision edition includes updated diagnostic criteria, prevalence information, and cultural considerations for identifying mental health conditions. ISBN 9780890425763.",2026-04-25T21:12:22Z,0,false
9781938936647,2015 Uniform Plumbing Code (ISBN 9781938936647) - ...,Paperback,69.99,https://www.booksgoat.com/2015-uniform-plumbing-code-9781938936647,315,90.99,active,,,,,,2026-05-02T07:00:05.561732,156582610011,"The 2015 Uniform Plumbing Code provides the technical standards and regulations that plumbing professionals, inspectors, and contractors rely on for installation and safety compliance. This edition includes updated requirements reflecting current industry practices and code changes from the previous version. ISBN 9781938936647.",2026-04-25T21:12:22Z,0,false
9781119662556,"Laboratory Manual for Anatomy and Physiology, 7th ...",Paperback,64.99,https://www.booksgoat.com/laboratory-manual-for-anatomy-and-physiology-7th-edition-9781119662556,315,84.49,active,,2026-04-20T08:31:58.203176,,,,2026-05-02T07:00:05.561732,156582627011,"Laboratory Manual for Anatomy and Physiology, 7th Edition (ISBN 9781119662556) provides hands-on exercises and experiments designed for students studying human body systems in anatomy and physiology courses. This edition includes updated lab procedures and detailed anatomical illustrations to support practical learning and understanding of physiological concepts. Perfect for nursing, pre-med, and health science students.",2026-04-25T21:12:22Z,0,false
9781265620424,"Site Planning and Design Handbook by Thomas Russ, ...",Paperback,69.99,https://www.booksgoat.com/site-planning-and-design-handbook-2nd-edition-9781265620424,315,90.99,active,,,,,,2026-05-02T07:00:05.561732,156582649011,"Site Planning and Design Handbook by Thomas Russ provides practical guidance on planning, design principles, and site development strategies for professionals and students in architecture and urban planning. This edition includes detailed illustrations and case studies that demonstrate real-world applications of site planning concepts. The book offers step-by-step methodologies for evaluating and designing sites across diverse project types and scales.",,0,false
9781108965910,Core Radiology: A Visual Approach to Diagnostic Im...,Paperback,96.99,https://www.booksgoat.com/index.php?route=product/product&path=315&product_id=426706,315,126.09,active,,2026-04-20T08:32:09.203513,,,,2026-05-02T07:00:05.561732,156582671011,Core Radiology: A Visual Approach to Diagnostic Imaging covers fundamental radiological principles and image interpretation techniques for medical students and practicing clinicians. This textbook features high-quality diagnostic images with detailed visual explanations to reinforce learning of key concepts. ISBN 9781108965910.,2026-04-25T21:12:22Z,0,false
9780521809269,"The Art of Electronics, 3rd edition by Paul Horowi...",Paperback,76.99,https://www.booksgoat.com/the-art-of-electronics-3rd-edition-9780521809269,315,100.09,active,,2026-04-20T08:32:15.094092,,,,2026-05-02T07:00:05.561732,156582697011,"The Art of Electronics, 3rd edition, covers analog and digital circuit design fundamentals for students, engineers, and hobbyists seeking practical knowledge. This updated edition includes modern components, expanded coverage of microcontrollers and programmable logic, and over 1,000 pages of detailed explanations with real-world examples. Hundreds of circuits and design techniques make this an invaluable reference for anyone building electronic projects.",2026-04-25T21:12:22Z,40,true
9781119460985,Point-of-Care Ultrasound Techniques for the Small ...,Paperback,89.99,https://www.booksgoat.com/index.php?route=product/product&path=315&product_id=428203,315,116.99,active,,2026-04-20T08:32:22.075195,,,,2026-05-02T07:00:05.561732,156582738011,This textbook covers point-of-care ultrasound techniques designed for small animal practitioners and veterinary students seeking to integrate diagnostic imaging into clinical practice. The book includes detailed procedural guidance with practical illustrations to support hands-on learning and skill development. ISBN: 9781119460985.,2026-04-25T21:12:22Z,0,false
9780815366546,Behavior Modification: What It Is and How To Do It...,Paperback,79.99,https://www.booksgoat.com/behavior-modification-11thedition-martin-9780815366546,315,103.99,active,,2026-04-20T08:32:31.675514,,,,2026-05-02T07:00:05.561732,156582785011,"This textbook covers the principles and practical applications of behavior modification for students and professionals in psychology, education, and human services. The book includes real-world examples and step-by-step techniques to help readers understand and implement behavioral change strategies effectively.",2026-04-25T21:12:22Z,0,false
9781884989117,Spacecraft Thermal Control Handbook – Edited by ...,Paperback,53.99,https://www.booksgoat.com/index.php?route=product/product&path=315&product_id=409588,315,70.19,active,,2026-04-20T08:32:38.830842,,,,2026-05-02T07:00:05.561732,156582823011,"This handbook provides practical guidance on thermal control systems for spacecraft design and operation, serving engineers and professionals in aerospace and satellite development. The volume includes detailed technical data, analytical methods, and real-world applications across various mission types and thermal environments.",2026-04-25T21:12:22Z,0,false
9781641950565,ACI CODE-318-19(22): Building Code Requirements fo...,Paperback,76.99,https://www.booksgoat.com/aci-318-19-building-code-book-structural-concrete,315,,pending,,,,,,,156576814011,"ACI CODE-318-19(22): Building Code Requirements fo...

ISBN-13: 9781641950565",,0,false
9781544343242,Counseling Individuals Through the Lifespan 2nd ed...,Paperback,69.99,https://www.booksgoat.com/counseling-individuals-lifespan-2nd-wong-hall-hernandez,315,90.99,active,,2026-04-20T08:32:54.904209,,,,2026-05-02T07:00:05.561732,156582840011,"This second edition textbook covers counseling theories and techniques for clients across all life stages, designed for students and practitioners in mental health and counseling fields. The updated edition includes current research, case studies, and practical applications to help readers develop real-world clinical skills. ISBN: 9781544343242.",2026-04-25T21:12:22Z,0,false
9781138369917,Introduction to Probability by Joseph K. Blitzstei...,Paperback,46.99,https://www.booksgoat.com/introduction-to-probability-2nd-edition-9781138369917,315,61.09,active,,2026-04-20T08:33:01.792722,,,,2026-05-02T07:00:05.561732,156582861011,"Introduction to Probability by Joseph K. Blitzstein covers foundational probability theory and applications, ideal for students in mathematics, statistics, and engineering. This edition features clear explanations with numerous worked examples and practice problems to reinforce learning. The ISBN is 9781138369917.",2026-04-25T21:12:22Z,0,false
9781285769417,"Milady Standard Cosmetology 2016, 13th edition (IS...",Paperback,109.99,https://www.booksgoat.com/milady-standard-cosmetology-2016,315,142.99,active,,2026-04-20T08:33:08.401171,,,,2026-05-02T07:00:05.561732,156582879011,"Milady Standard Cosmetology 13th Edition (ISBN 9781285769417) covers foundational and advanced techniques in hair, skin, and nail care for students pursuing cosmetology licensure. This 2016 edition includes updated industry standards and integrated practice questions to reinforce learning. The textbook serves as a primary resource for both classroom instruction and exam preparation.",2026-04-25T21:12:22Z,0,false
9781591268567,PPI PE Structural 16-Hour Practice Exam for Buildi...,Paperback,69.99,https://www.booksgoat.com/ppi-pe-structural-16-hour-practice-exam-buildings-6th-edition-9781591268567,315,90.99,active,,2026-04-20T08:33:15.688900,,,,2026-05-02T07:00:05.561732,156582892011,This PPI PE Structural 16-Hour Practice Exam book prepares civil engineers for the PE structural exam with realistic test simulations. The exam includes 160 practice questions across two full-length exams that mirror the actual test format and difficulty level. ISBN 9781591268567.,2026-04-25T21:12:22Z,0,false
9781617316203,Exploring Anatomy & Physiology in the Laborato...,Paperback,69.99,https://www.booksgoat.com/index.php?route=product/product&path=315&product_id=427014,315,90.99,active,,2026-04-20T08:33:21.398666,,,,2026-05-02T07:00:05.561732,156582920011,This laboratory manual guides students through hands-on exploration of human anatomy and physiology with practical exercises and real-world applications. The text includes detailed anatomical illustrations and diagrams that support understanding of complex biological structures and processes. ISBN: 9781617316203.,2026-04-25T21:12:22Z,0,false
9781579478889,"Guides to the Evaluation of Permanent Impairment, ...",Paperback,89.99,https://www.booksgoat.com/guides-to-the-evaluation-of-permanent-impairment-6th-edition-9781579478889,315,116.99,active,,2026-04-20T08:33:28.844192,,,,2026-05-02T07:00:05.561732,156582949011,"This guide provides healthcare professionals and evaluators with standardized methods for assessing and rating permanent impairment across various medical conditions and body systems. The book includes detailed rating scales, diagnostic criteria, and clinical examples to support consistent and objective impairment evaluations. ISBN 9781579478889.",2026-04-25T21:12:22Z,0,false
9780323905497,"Formulas and Calculations for Drilling, Production...",Paperback,79.99,https://www.booksgoat.com/formulas-and-calculations-for-drilling-production-and-workover-5th-edition,315,103.99,active,,2026-04-20T08:33:34.720115,,,,2026-05-02T07:00:05.561732,156582992011,"Comprehensive resource covering formulas and calculations essential for drilling and production operations in the oil and gas industry, designed for engineers, technicians, and field professionals. This reference includes practical worked examples and real-world applications to support quick problem-solving on the job site.",2026-04-25T21:12:22Z,0,false
9781577667391,"Factory Physics, 3rd Edition by Wallace J. Hopp &a...",Paperback,59.99,https://www.booksgoat.com/factory-physics-3rd-edition-9781577667391,315,121.55,active,3.512956,2026-04-18T06:40:15.811805,,,,2026-05-02T07:00:05.561732,156583012011,"Factory Physics, 3rd Edition by Wallace J. Hopp covers manufacturing systems, production planning, and supply chain management for students and professionals in industrial engineering. This third edition includes updated real-world case studies and integrated software tools that help readers apply theoretical concepts to practical factory operations. The text combines quantitative methods with operational insights for managing complex production environments.",2026-04-25T21:12:22Z,0,false
9781569003930,"Occupational Therapy in Acute Care, 2nd edition by...",Paperback,66.99,https://www.booksgoat.com/Occupational-theory-in-acute-care-9781569003930,315,87.09,active,,2026-04-20T08:33:40.464712,,,,2026-05-02T07:00:05.561732,156583050011,"Occupational Therapy in Acute Care, 2nd edition (ISBN: 9781569003930) covers evidence-based OT practice in hospital and emergency settings for students and clinicians. This updated edition includes current clinical guidelines and real-world case applications to bridge theory and practice. An ideal reference for acute care professionals seeking practical intervention strategies.",2026-04-25T21:12:22Z,0,false
9788350705218,"Sterile Processing Technical Manual (CRCST), 9th E...",Paperback,59.99,https://www.booksgoat.com/sterile-processing-technical-manual-9th-edition,315,,pending,,,,,,,154288293011,,,0,false
9780262039246,"Reinforcement Learning: An Introduction, 2nd Editi...",Paperback,51.99,https://www.booksgoat.com/reinforcement-learning-2nd-edition-sutton-barto,315,67.59,active,,2026-04-20T08:33:55.615164,,,,2026-05-02T07:00:05.561732,156583090011,"Reinforcement Learning: An Introduction, 2nd Edition, covers the foundational algorithms and theory of RL for students and practitioners in artificial intelligence and machine learning. This updated edition includes new material on deep reinforcement learning and modern applications that have emerged since the first edition. The book balances mathematical rigor with practical intuition through worked examples and exercises.",2026-04-25T21:12:22Z,0,false
9781944366445,2021 Uniform Mechanical Code Soft Cover with Tabs ...,Paperback,79.99,https://www.booksgoat.com/2021-uniform-mechanical-code-soft-cover-tabs-9781944366445,315,127.3,active,0.838808,2026-04-20T14:11:53.558851,,,,2026-05-02T07:00:05.561732,156583127011,"This 2021 Uniform Mechanical Code soft cover edition is designed for HVAC professionals, contractors, and inspectors who need quick access to current mechanical standards and regulations. The pre-installed tabs enable rapid navigation to frequently referenced sections during on-site inspections and installations. ISBN: 9781944366445.",,0,false
9781108473224,"Modern Quantum Mechanics, 3rd Edition by J. J. Sak...",Paperback,46.99,https://www.booksgoat.com/modern-quantum-mechanics-3rd-edition-9781108473224,315,61.09,active,,2026-04-20T08:34:08.383168,,,,2026-05-02T07:00:05.561732,156583146011,"Modern Quantum Mechanics, 3rd Edition by J. J. Sakurai, provides a rigorous treatment of quantum theory for advanced undergraduate and graduate students. This updated edition incorporates contemporary applications and refined explanations that strengthen understanding of fundamental quantum principles. ISBN: 9781108473224.",2026-04-25T21:12:22Z,0,false
9781933578170,"FYI: For Your Improvement – For Learners, Manage...",Paperback,41.99,https://www.booksgoat.com/fyi-for-your-improvement-5th-edition-9781933578170,315,54.59,active,,2026-04-20T08:34:18.325652,,,,2026-05-02T07:00:05.561732,156583165011,FYI: For Your Improvement is a professional development guide designed for managers and leaders seeking to enhance their coaching and feedback skills. This edition includes practical strategies and assessments to help learners identify development areas and create meaningful improvement plans. ISBN: 9781933578170.,2026-04-25T21:12:22Z,0,false
9781948558396,"NASCLA Contractors Guide to Business, Law and Proj...",Paperback,47.99,https://www.booksgoat.com/nascla-contractors-guide-book-14th-edition-business-law,315,,pending,,,,,,,154288331011,,,0,false
9781285080475,"Milady Standard Nail Technology, 7th Edition by Mi...",Paperback,79.99,https://www.booksgoat.com/milady-standard-nail-technology-7th-edition,315,103.99,active,,2026-04-20T08:34:30.448745,,,,2026-05-02T07:00:05.561732,156583180011,"Milady Standard Nail Technology, 7th Edition (ISBN 9781285080475) covers nail care, salon practices, and professional techniques for students and practitioners entering the nail industry. This edition includes updated content reflecting current industry standards and best practices. Ideal for exam preparation and building foundational knowledge in nail technology.",2026-04-25T21:12:22Z,2,false
9781948558143,"NASCLA Contractors Guide to Business, Law and Proj...",Paperback,79.99,https://www.booksgoat.com/nascla-contractors-guide-book-13th-edition-business-law,315,,pending,,,,,,,154288373011,,,0,false
9781119861904,Counseling the Culturally Diverse: Theory and Prac...,Paperback,56.99,https://www.booksgoat.com/counseling-culturally-diverse-9th-sue-neville,315,74.09,active,,2026-04-20T08:34:41.245108,,,,2026-05-02T07:00:05.561732,156583199011,"Counseling the Culturally Diverse: Theory and Practice provides counselors and mental health professionals with frameworks for delivering effective, culturally competent care across diverse client populations. This seventh edition (ISBN 9781119861904) incorporates contemporary research and updated case studies reflecting current clinical applications. The text balances theoretical foundations with practical strategies for real-world therapeutic settings.",2026-04-25T21:12:22Z,0,false
9781108971638,Stahl’s Essential Psychopharmacology: Neuroscien...,Paperback,79.99,https://www.booksgoat.com/stahls-essential-psychopharmacology-5th-edition-9781108971638,315,103.99,active,,2026-04-20T08:34:52.311772,,,,2026-05-02T07:00:05.561732,156583227011,"Stahl's Essential Psychopharmacology provides in-depth neuroscience foundations and practical medication knowledge for psychiatrists, pharmacists, and mental health professionals. This fourth edition features updated drug interactions, mechanisms of action, and clinical applications with full-color illustrations to clarify complex neurobiological concepts. The ISBN is 9781108971638.",2026-04-25T21:12:22Z,0,false
9781462543755,"Handbook of Applied Behavior Analysis, 2nd Edition...",Paperback,49.99,https://www.booksgoat.com/handbook-of-applied-behavior-analysis-2nd-edition-9781462543755,315,64.99,active,,,,,,2026-05-02T07:00:05.561732,156583247011,"This second edition handbook provides practical applications of behavior analysis for professionals and students in psychology, education, and clinical practice. It features updated research, case studies, and evidence-based strategies for implementing behavior modification across diverse settings. The text combines theoretical foundations with real-world examples to support both learning and professional application.",2026-04-25T21:12:22Z,0,false
9781138852976,Research Methods in Applied Settings: An Integrate...,Paperback,69.99,https://www.booksgoat.com/index.php?route=product/product&path=315&product_id=409261,315,90.99,active,,,,,,2026-05-02T07:00:05.561732,156583274011,"Research Methods in Applied Settings provides practical guidance on conducting research in real-world environments, ideal for students and professionals in social sciences and applied fields. This integrated approach combines theoretical foundations with hands-on techniques for designing and implementing studies outside traditional laboratory settings. ISBN: 9781138852976.",2026-04-25T21:12:22Z,0,false
9780134785431,Family Therapy: An Overview 9th Edition by Irene G...,Paperback,57.99,https://www.booksgoat.com/family-therapy-history-theory-and-practice-7th-edition-9780134785431,315,75.39,active,,,,,,2026-05-02T07:00:05.561732,156583295011,Family Therapy: An Overview 9th Edition by Irene G. (ISBN: 9780134785431) covers foundational concepts and therapeutic approaches for students and practitioners studying family systems and relational dynamics. This edition includes updated case studies and contemporary clinical examples that reflect current practice standards. The textbook provides practical frameworks for understanding family interaction patterns and intervention strategies.,2026-04-25T21:12:22Z,0,false
9781119855675,"Fogoros' Electrophysiologic Testing, 7th Edition b...",Paperback,44.99,https://www.booksgoat.com/Fogors-Electrophysiologic-Testing-9781119855675,315,58.49,active,,2026-04-20T08:34:58.344014,,,,2026-05-02T07:00:05.561732,156583322011,"Fogoros' Electrophysiologic Testing, 7th Edition, covers cardiac arrhythmia diagnosis and management through electrophysiology procedures, designed for cardiologists, electrophysiologists, and medical students. This updated edition includes the latest clinical protocols and diagnostic techniques for interpreting electrophysiologic studies. ISBN: 9781119855675.",2026-04-25T21:12:22Z,0,false
9781498777803,"CRC Standard Mathematical Tables and Formulas, 33r...",Paperback,39.99,https://www.booksgoat.com/crc-standard-mathematical-tables-and-formulas-33rd-edition-9781498777803,315,51.99,active,,,,,,2026-05-02T07:00:05.561732,156583344011,"CRC Standard Mathematical Tables and Formulas, 33rd Edition, provides quick-reference mathematical data, constants, and formulas for students, engineers, and professionals across scientific disciplines. This edition includes over 4,000 formulas and tables with updated content reflecting current mathematical standards. The compact, indexed format makes it ideal for exam preparation and problem-solving in academic and professional settings.",2026-04-25T21:12:22Z,0,false
9781506386706,"Research Design: Qualitative, Quantitative, and Mi...",Paperback,52.99,https://www.booksgoat.com/research-design-qualitative-quantitative-mixed-methods-5th-edition,315,68.89,active,,2026-04-20T08:35:05.437626,,,,2026-05-02T07:00:05.561732,156583366011,"This textbook covers qualitative, quantitative, and mixed methods research design, making it ideal for graduate students and researchers developing research skills. The book includes real-world examples and practical guidance that help readers apply methodological concepts to actual research projects. ISBN 9781506386706.",2026-04-25T21:12:22Z,0,false
9780199307173,Treating Nonepileptic Seizures: Therapist Guide (T...,Paperback,56.99,https://www.booksgoat.com/treating-nonepileptic-seizures-therapist-guide-lafrance-wincze,315,74.09,active,,,,,,2026-05-02T07:00:05.561732,156583379011,"This therapist guide provides evidence-based treatment strategies for patients experiencing nonepileptic seizures, addressing both assessment and intervention techniques for mental health professionals. The book includes detailed case examples and session-by-session protocols to support clinical implementation. ISBN: 9780199307173.",2026-04-25T21:12:22Z,0,false
